{
  "model_id": "MKM-SI-001",
  "doc_type": "model_documentation",
  "title": "Storm Intensity Distribution — Model Documentation",
  "filename": "MKM-SI-001_model_doc.pdf",
  "content_type": "application/pdf",
  "version": "1.0.0",
  "author": "David K Kelly",
  "created_at": "2026-07-15T09:00:00Z",
  "notes": "Auto-generated on model creation; uploaded to ModelRisk."
}
